{
  "version": 2,
  "document_order": "utf16-code-unit",
  "hash_algorithm": "sha256",
  "root_hash": "sha256:71587ba6205c2bbd2fc29a4bb6c0580c6706d6c17a4d60a6b5e21be21869129a",
  "documents": [
    {
      "path": ".agent-context/tasks/T-AGENT-GUIDANCE-STATUS-001/brief.md",
      "content_hash": "sha256:522d76202bcd8f31e74394d01478a4c32dec59a09cd4589878635fb7d2362086",
      "stand": "2026-10-03",
      "status": "completed",
      "truth_level": "active-snapshot",
      "verification_state": "verified",
      "read_if_task_touches": [
        "bundled agent guidance",
        "readable task status"
      ],
      "primary_systems": [
        "CLI guidance"
      ],
      "do_not_use_instead": [
        "ARTIFACT_PROTOCOL.md",
        "docs/usage.md"
      ],
      "topic_id": "bundled-agent-guide-and-status"
    },
    {
      "path": ".agent-context/tasks/T-AGENT-GUIDANCE-STATUS-001/evidence/self-review.md",
      "content_hash": "sha256:353249f693b1339a1fac581fc758a7dab0105e41928f8dcf808bcd2d4acd089c",
      "stand": "2026-10-03",
      "status": "author-reviewed",
      "truth_level": "active-snapshot",
      "verification_state": "internally-reviewed",
      "read_if_task_touches": [
        "bundled guidance self-review"
      ],
      "primary_systems": [
        "CLI guidance"
      ],
      "do_not_use_instead": [
        "ARTIFACT_PROTOCOL.md"
      ],
      "topic_id": "bundled-guidance-self-review"
    },
    {
      "path": ".agent-context/tasks/T-AGENT-GUIDANCE-STATUS-001/evidence/verification.md",
      "content_hash": "sha256:0c65827b5cac771c35c48c35d09d2cd10a9b6b12470281fe3a60cd3a174dac08",
      "stand": "2026-10-03",
      "status": "checked-local",
      "truth_level": "active-snapshot",
      "verification_state": "internally-reviewed",
      "read_if_task_touches": [
        "bundled guidance verification"
      ],
      "primary_systems": [
        "CLI guidance"
      ],
      "do_not_use_instead": [
        ".agent-context/tasks/T-AGENT-GUIDANCE-STATUS-001/state.yaml"
      ],
      "topic_id": "bundled-guidance-verification"
    },
    {
      "path": ".agent-context/tasks/T-ALPHA-CANDIDATE-001/brief.md",
      "content_hash": "sha256:6fbbde0f8ce3388238442b1a6f172ab0616e084749fdab5bad0cce2c45b08fe3",
      "stand": "2026-09-13",
      "status": "completed",
      "truth_level": "active-snapshot",
      "verification_state": "verified",
      "read_if_task_touches": [
        "alpha candidate preparation"
      ],
      "primary_systems": [
        "release preparation"
      ],
      "do_not_use_instead": [
        "VISION.md"
      ],
      "topic_id": "alpha-candidate-preparation-task"
    },
    {
      "path": ".agent-context/tasks/T-COMPACT-HANDOFF-001/brief.md",
      "content_hash": "sha256:505b7d76c8403b03e98cda1e2c7fe655579de34e4059a13c8ed3d7f5dd9e8567",
      "stand": "2026-10-09",
      "status": "completed",
      "truth_level": "active-snapshot",
      "verification_state": "verified",
      "read_if_task_touches": [
        "compact handoffs",
        "missing evidence reference diagnostics"
      ],
      "primary_systems": [
        "context continuity"
      ],
      "do_not_use_instead": [
        "ARTIFACT_PROTOCOL.md"
      ],
      "topic_id": "task-compact-handoff-001"
    },
    {
      "path": ".agent-context/tasks/T-COMPACT-HANDOFF-001/evidence/precommit-review-r3.md",
      "content_hash": "sha256:8c787f873b617ac50e9649b0b8810c5ba53285c3de11963116183b35ec015994",
      "stand": "2026-09-27",
      "status": "author-tested-review-pending",
      "truth_level": "active-snapshot",
      "verification_state": "internally-reviewed",
      "read_if_task_touches": [
        "raw-byte inventory collision",
        "compact handoff precommit checks"
      ],
      "primary_systems": [
        "context continuity"
      ],
      "do_not_use_instead": [
        "ARTIFACT_PROTOCOL.md"
      ],
      "topic_id": "compact-handoff-precommit-review-r3"
    },
    {
      "path": ".agent-context/tasks/T-COMPACT-HANDOFF-001/evidence/review-remediation.md",
      "content_hash": "sha256:67983ef76954d6a43c06b8f5b5ae9072b85d3b9e9e0c1d164b5807b71791583c",
      "stand": "2026-09-27",
      "status": "implemented-review-pending",
      "truth_level": "active-snapshot",
      "verification_state": "internally-reviewed",
      "read_if_task_touches": [
        "compact handoff review remediation"
      ],
      "primary_systems": [
        "context continuity"
      ],
      "do_not_use_instead": [
        "ARTIFACT_PROTOCOL.md"
      ],
      "topic_id": "compact-handoff-review-remediation"
    },
    {
      "path": ".agent-context/tasks/T-COMPACT-HANDOFF-001/evidence/review-request.md",
      "content_hash": "sha256:b7caa4c82b518c60dc4a18e3b1438b5df2896609dbbda52d2064fc6103171efa",
      "stand": "2026-09-26",
      "status": "pending",
      "truth_level": "active-snapshot",
      "verification_state": "unverified",
      "read_if_task_touches": [
        "independent compact handoff review"
      ],
      "primary_systems": [
        "context continuity"
      ],
      "do_not_use_instead": [
        "ARTIFACT_PROTOCOL.md"
      ],
      "topic_id": "compact-handoff-independent-review-request"
    },
    {
      "path": ".agent-context/tasks/T-CONTEXT-BUDGET-CLARITY-001/brief.md",
      "content_hash": "sha256:e27452cdea9c03d9df1586b5661081597d1be52e9abb9976a03013299ac1935e",
      "stand": "2026-09-25",
      "status": "completed",
      "truth_level": "active-snapshot",
      "verification_state": "internally-reviewed",
      "read_if_task_touches": [
        "context budget diagnostics",
        "explicit source sections",
        "task-scoped finalization"
      ],
      "primary_systems": [
        "context compilation",
        "completion reporting"
      ],
      "do_not_use_instead": [
        "ARTIFACT_PROTOCOL.md",
        "VISION.md"
      ],
      "topic_id": "task-context-budget-clarity-001"
    },
    {
      "path": ".agent-context/tasks/T-CONTINUITY-WRITE-HARDENING-001/brief.md",
      "content_hash": "sha256:2b8adbe0f53537955ee862d6e195750efdceee0d72c6232d32dcf243ca054260",
      "stand": "2026-10-09",
      "status": "completed",
      "truth_level": "active-snapshot",
      "verification_state": "verified",
      "read_if_task_touches": [
        "continuity write hardening",
        "retained handoff integrity"
      ],
      "primary_systems": [
        "context continuity"
      ],
      "do_not_use_instead": [
        "ARTIFACT_PROTOCOL.md"
      ],
      "topic_id": "task-continuity-write-hardening-001"
    },
    {
      "path": ".agent-context/tasks/T-CONTINUITY-WRITE-HARDENING-001/evidence/review-intake.md",
      "content_hash": "sha256:73ff1bb8dc61b839561fc4db3dc332de503c36373f9b59265da00fb0ef2994f2",
      "stand": "2026-09-27",
      "status": "triaged",
      "truth_level": "active-snapshot",
      "verification_state": "internally-reviewed",
      "read_if_task_touches": [
        "continuity hardening review scope"
      ],
      "primary_systems": [
        "context continuity"
      ],
      "do_not_use_instead": [
        "ARTIFACT_PROTOCOL.md"
      ],
      "topic_id": "continuity-write-hardening-review-intake"
    },
    {
      "path": ".agent-context/tasks/T-CONTINUITY-WRITE-HARDENING-001/evidence/verification.md",
      "content_hash": "sha256:527e5cebdf33e6a7e9b8b6fdd5739bb507a370a8bc4bbe6cc4f59bb293c58f4b",
      "stand": "2026-09-27",
      "status": "current",
      "truth_level": "active-snapshot",
      "verification_state": "internally-reviewed",
      "read_if_task_touches": [
        "continuity write hardening verification",
        "review follow-up"
      ],
      "primary_systems": [
        "context continuity"
      ],
      "do_not_use_instead": [
        "ARTIFACT_PROTOCOL.md"
      ],
      "topic_id": "continuity-write-hardening-verification-001"
    },
    {
      "path": ".agent-context/tasks/T-DOCS-FRESHNESS-20261018/brief.md",
      "content_hash": "sha256:e809eb19ddaa3646f56981abc9d583014358cfa0a5eb2123149eaecfc72081ed",
      "stand": "2026-10-18",
      "status": "completed",
      "truth_level": "active-snapshot",
      "verification_state": "verified",
      "read_if_task_touches": [
        "T-DOCS-FRESHNESS-20261018"
      ],
      "primary_systems": [],
      "do_not_use_instead": [
        "AGENTS.md"
      ],
      "topic_id": "task-T-DOCS-FRESHNESS-20261018"
    },
    {
      "path": ".agent-context/tasks/T-DOCS-FRESHNESS-20261018/evidence/review.md",
      "content_hash": "sha256:fac2f731e85d823fee96d698938ae5bff8417d26eca03a6c222e300c1e126a28",
      "stand": "2026-10-18",
      "status": "verified-local",
      "truth_level": "active-snapshot",
      "verification_state": "verified",
      "read_if_task_touches": [
        "T-DOCS-FRESHNESS-20261018",
        "six-document freshness review"
      ],
      "primary_systems": [
        "documentation maintenance"
      ],
      "do_not_use_instead": [
        "ARTIFACT_PROTOCOL.md"
      ],
      "topic_id": "documentation-freshness-review-20261018"
    },
    {
      "path": ".agent-context/tasks/T-FIELD-AUTHORING-002/brief.md",
      "content_hash": "sha256:b708a814dbb5d05abb67df80e2e0ea4de9dfd8c5ee8c7340c568fe29d1f2ca77",
      "stand": "2026-10-09",
      "status": "completed",
      "truth_level": "active-snapshot",
      "verification_state": "verified",
      "read_if_task_touches": [
        "T-FIELD-AUTHORING-002"
      ],
      "primary_systems": [
        "document authoring",
        "evidence snapshots"
      ],
      "do_not_use_instead": [
        "AGENTS.md",
        "ARTIFACT_PROTOCOL.md"
      ],
      "topic_id": "task-field-authoring-002"
    },
    {
      "path": ".agent-context/tasks/T-FIELD-AUTHORING-002/evidence/author-review.md",
      "content_hash": "sha256:c5a35e6fb27956ef9d1bf0f947f965fdeea170e1d2b16f8de839881c3fdf4c5a",
      "stand": "2026-10-08",
      "status": "author-review-only",